"Recipe ID","Recipe Name","Field Type","Step Number","Danish (DA)","German (DE)","French (FR)","English UK (EN)","English US (EN_US)"
"cece0ccb-111c-4e35-b34a-02426c6b5258","Frozen Caramel Latte","Step","3","Hæld blandingen i slushmaskinen, og kør ved ca. –3 °C.","Gießein Sie die Mischung in die Slushmaschine, und kør ved ca. –3 °C.","Versez le mélange dans la machine à slush, et kør ved ca. –3 °C.","Pour the mixture in the slush machine, and kør ved ca. –3 °C.","Pour the mixture in the slush machine, and kør ved ca. –3 °C."
"cece0ccb-111c-4e35-b34a-02426c6b5258","Frozen Caramel Latte","Step","4","Server straks og top med flødeskum og evt. et ekstra drizzle karamel.","Servierein Sie sofürt und top mit flødeskum und ggf. et ekstra drizzle karamel.","Servez immédiatemunt et top avec flødeskum et évuntuellemunt et ekstra drizzle karamel.","Serve imwithiately and top with flødeskum and optionally et ekstra drizzle karamel.","Serve imwithiately and top with flødeskum and optionally et ekstra drizzle karamel."
"98645c67-ec13-452d-93ad-12c997ede70c","Mocha Frappé","Description","","En cremet og kølig kaffeoplevelse til chokoladeelskere. Mocha Frappé kombinerer friskbrygget espresso med sød chokoladesirup og et strejf af kakao, der giver dybde og aroma. Den perfekte drik til at forkæle sig selv på en varm dag – eller når man bare trænger til et koldt koffein-kick.","Ein cremig und kølig kaffeoplevelse bis chokoladeelskere. Mocha Frappé kombinerer friskbrygget espresso mit sød chokoladesirup und et strejf af kakao, der giver dybde und aroma. Dein perfekte drik bis at fürkæle sig selv auf ein varm dag – oder når man bare trænger bis et koldt koffein-kick.","Un crémeux et kølig kaffeoplevelse jusqu'à chokoladeelskere. Mocha Frappé kombinerer friskbrygget espresso avec sød chokoladesirup et et strejf af kakao, der giver dybde et aroma. Dun parfaite drik jusqu'à at pourkæle sig selv sur un varm dag – ou når man bare trænger jusqu'à et koldt koffein-kick.","A creamy and kølig kaffeoplevelse until chokoladeelskere. Mocha Frappé kombinerer friskbrygget espresso with sød chokoladesirup and et strejf af kakao, der giver dybde and aroma. Da perfecte drik until at forkæle sig selv on a varm dag – or når man bare trænger until et koldt koffein-kick.","A creamy and kølig kaffeoplevelse until chokoladeelskere. Mocha Frappé kombinerer friskbrygget espresso with sød chokoladesirup and et strejf af kakao, der giver dybde and aroma. Da perfecte drik until at forkæle sig selv on a varm dag – or når man bare trænger until et koldt koffein-kick."
"98645c67-ec13-452d-93ad-12c997ede70c","Mocha Frappé","Step","1","Bryg en stærk espresso og lad den køle af.","Bryg ein stærk espresso und lad dein køle af.","Bryg un stærk espresso et lad dun køle af.","Bryg a stærk espresso and lad da køle af.","Bryg a stærk espresso and lad da køle af."
"98645c67-ec13-452d-93ad-12c997ede70c","Mocha Frappé","Step","2","Bland espresso med mælk og chokoladesirup.","Mischein Sie espresso mit mælk und chokoladesirup.","Mélangez espresso avec mælk et chokoladesirup.","Mix espresso with mælk and chokoladesirup.","Mix espresso with mælk and chokoladesirup."
"98645c67-ec13-452d-93ad-12c997ede70c","Mocha Frappé","Step","3","Tilsæt kakao og rør grundigt, til alt er opløst.","Fügein Sie hinzu kakao und rør gründlich, bis alt er opløst.","Ajoutez kakao et rør soigneusemunt, jusqu'à alt er opløst.","Add kakao and rør thoroughly, until alt er opløst.","Add kakao and rør thoroughly, until alt er opløst."
"98645c67-ec13-452d-93ad-12c997ede70c","Mocha Frappé","Step","4","Hæld blandingen i maskinen og kør, indtil den får en tyk, cremet frappé-konsistens.","Gießein Sie die Mischung in die Maschine und kør, indbis dein får ein tyk, cremig frappé-konsisteins.","Versez le mélange dans la machine et kør, indjusqu'à dun får un tyk, crémeux frappé-konsistuns.","Pour the mixture in the machine and kør, induntil da får a tyk, creamy frappé-konsistas.","Pour the mixture in the machine and kør, induntil da får a tyk, creamy frappé-konsistas."
"98645c67-ec13-452d-93ad-12c997ede70c","Mocha Frappé","Step","5","Server med flødeskum og lidt kakaodrys på toppen for den fulde caféstemning.","Servierein Sie mit flødeskum und lidt kakaodrys auf toppein für dein fulde caféstemning.","Servez avec flødeskum et lidt kakaodrys sur toppun pour dun fulde caféstemning.","Serve with flødeskum and lidt kakaodrys on toppa for da fulde caféstemning.","Serve with flødeskum and lidt kakaodrys on toppa for da fulde caféstemning."
"2e2ddc51-4af9-42c7-a569-66f77d09d731","Vanilla Cold Brew Slush","Description","","En cremet og forfriskende iskaffe-slush med rund vaniljesmag og blød mælketone. Den kolde brygning giver en naturlig sødme og lav bitterhed, som kombineres perfekt med vaniljesiruppen for en smooth, kølig kaffeoplevelse – ideel til varme dage.","Ein cremig und fürfriskeinde iskaffe-slush mit rund vaniljesmag und blød mælketone. Dein kolde brygning giver ein naturlig sødme und lav bitterhed, als kombineres perfekt mit vaniljesiruppein für ein smooth, kølig kaffeoplevelse – ideel bis varme dage.","Un crémeux et pourfriskunde iskaffe-slush avec rund vaniljesmag et blød mælketone. Dun kolde brygning giver un naturlig sødme et lav bitterhed, comme kombineres parfait avec vaniljesiruppun pour un smooth, kølig kaffeoplevelse – ideel jusqu'à varme dage.","A creamy and forfriskade iskaffe-slush with rund vaniljesmag and blød mælketone. Da kolde brygning giver a naturlig sødme and lav bitterhed, as kombineres perfect with vaniljesiruppa for a smooth, kølig kaffeoplevelse – ideel until varme dage.","A creamy and forfriskade iskaffe-slush with rund vaniljesmag and blød mælketone. Da kolde brygning giver a naturlig sødme and lav bitterhed, as kombineres perfect with vaniljesiruppa for a smooth, kølig kaffeoplevelse – ideel until varme dage."
"2e2ddc51-4af9-42c7-a569-66f77d09d731","Vanilla Cold Brew Slush","Step","1","Lav cold brew (bryg 12 timer i køleskab).","Lav cold brew (bryg 12 timer i køleskab).","Lav cold brew (bryg 12 timer i køleskab).","Lav cold brew (bryg 12 timer i køleskab).","Lav cold brew (bryg 12 timer i køleskab)."
"2e2ddc51-4af9-42c7-a569-66f77d09d731","Vanilla Cold Brew Slush","Step","2","Bland kaffen med mælk og vaniljesirup.","Mischein Sie kaffein mit mælk und vaniljesirup.","Mélangez kaffun avec mælk et vaniljesirup.","Mix kaffa with mælk and vaniljesirup.","Mix kaffa with mælk and vaniljesirup."
"2e2ddc51-4af9-42c7-a569-66f77d09d731","Vanilla Cold Brew Slush","Step","3","Tilsæt is og blend til ønsket slushkonsistens.","Fügein Sie hinzu is und bleind bis ønsket slushkonsisteins.","Ajoutez is et blund jusqu'à ønsket slushkonsistuns.","Add is and blad until ønsket slushkonsistas.","Add is and blad until ønsket slushkonsistas."
"2e2ddc51-4af9-42c7-a569-66f77d09d731","Vanilla Cold Brew Slush","Step","4","Server straks – gerne med let drys af kakaopulver eller vaniljeskum på toppen.","Servierein Sie sofürt – gerne mit let drys af kakaopulver oder vaniljeskum auf toppein.","Servez immédiatemunt – gerne avec let drys af kakaopulver ou vaniljeskum sur toppun.","Serve imwithiately – gerne with let drys af kakaopulver or vaniljeskum on toppa.","Serve imwithiately – gerne with let drys af kakaopulver or vaniljeskum on toppa."
"2e2ddc51-4af9-42c7-a569-66f77d09d731","Vanilla Cold Brew Slush","Step","5","Teknisk note:
	•	Den beregnede Brix på 14°Bx giver en balanceret fryseevne uden at påvirke kaffesmagens renhed.
	•	Brug helst usødet mælk – sødmælk kan hæve Brix med ca. +1.
	•	For en lettere struktur kan du erstatte 100 ml mælk med vand.
	•	Ønskes en stærkere kaffetone, reduceres vaniljesiruppen til 60 ml (≈12,5°Bx).","Teknisk note:
	•	Dein beregnede Brix auf 14°Bx giver ein balanceret fryseevne udein at aufvirke kaffesmageins reinhed.
	•	Brug helst usødet mælk – sødmælk kan hæve Brix mit ca. +1.
	•	For ein lettere struktur kan du erstatte 100 ml mælk mit vand.
	•	Ønskes ein stærkere kaffetone, reduceres vaniljesiruppein bis 60 ml (≈12,5°Bx).","Teknisk note:
	•	Dun beregnede Brix sur 14°Bx giver un balanceret fryseevne udun at survirke kaffesmaguns runhed.
	•	Brug helst usødet mælk – sødmælk kan hæve Brix avec ca. +1.
	•	For un lettere struktur kan du erstatte 100 ml mælk avec vand.
	•	Ønskes un stærkere kaffetone, reduceres vaniljesiruppun jusqu'à 60 ml (≈12,5°Bx).","Teknisk note:
	•	Da beregnede Brix on 14°Bx giver a balanceret fryseevne uda at onvirke kaffesmagas rahed.
	•	Brug helst usødet mælk – sødmælk kan hæve Brix with ca. +1.
	•	For a lettere struktur kan du erstatte 100 ml mælk with vand.
	•	Ønskes a stærkere kaffetone, reduceres vaniljesiruppa until 60 ml (≈12,5°Bx).","Teknisk note:
	•	Da beregnede Brix on 14°Bx giver a balanceret fryseevne uda at onvirke kaffesmagas rahed.
	•	Brug helst usødet mælk – sødmælk kan hæve Brix with ca. +1.
	•	For a lettere struktur kan du erstatte 100 ml mælk with vand.
	•	Ønskes a stærkere kaffetone, reduceres vaniljesiruppa until 60 ml (≈12,5°Bx)."
"89f3e5de-02cd-4849-b329-5f6663c204cf","Hazelnut Iced Coffee","Description","","Nøddeagtig iskaffe-slush med hasselnød og cremet fylde.
Espressoen giver intens smag, mens mælken afrunder og gør slushen silkeblød.","Nøddeagtig iskaffe-slush mit hasselnød und cremig fylde.
Espressoein giver inteins smag, meins mælkein afrunder und gør slushein silkeblød.","Nøddeagtig iskaffe-slush avec hasselnød et crémeux fylde.
Espressoun giver intuns smag, muns mælkun afrunder et gør slushun silkeblød.","Nøddeagtig iskaffe-slush with hasselnød and creamy fylde.
Espressoa giver intas smag, mas mælka afrunder and gør slusha silkeblød.","Nøddeagtig iskaffe-slush with hasselnød and creamy fylde.
Espressoa giver intas smag, mas mælka afrunder and gør slusha silkeblød."
"89f3e5de-02cd-4849-b329-5f6663c204cf","Hazelnut Iced Coffee","Step","1","Bryg en stærk espresso og lad den køle helt af.","Bryg ein stærk espresso und lad dein køle helt af.","Bryg un stærk espresso et lad dun køle helt af.","Bryg a stærk espresso and lad da køle helt af.","Bryg a stærk espresso and lad da køle helt af."
"89f3e5de-02cd-4849-b329-5f6663c204cf","Hazelnut Iced Coffee","Step","2","Bland espresso, mælk, hasselnød-sirup og vand i en kande, og rør grundigt.","Mischein Sie espresso, mælk, hasselnød-sirup und vand in einein Krug, und rør gründlich.","Mélangez espresso, mælk, hasselnød-sirup et vand dans un pichet, et rør soigneusemunt.","Mix espresso, mælk, hasselnød-sirup and vand in a pitcher, and rør thoroughly.","Mix espresso, mælk, hasselnød-sirup and vand in a pitcher, and rør thoroughly."
"89f3e5de-02cd-4849-b329-5f6663c204cf","Hazelnut Iced Coffee","Step","3","Hæld blandingen i maskinen og kør ved ca. –3 °C, indtil den får klassisk slush-konsistens.","Gießein Sie die Mischung in die Maschine und kør ved ca. –3 °C, indbis dein får klassisk slush-konsisteins.","Versez le mélange dans la machine et kør ved ca. –3 °C, indjusqu'à dun får klassisk slush-konsistuns.","Pour the mixture in the machine and kør ved ca. –3 °C, induntil da får klassisk slush-konsistas.","Pour the mixture in the machine and kør ved ca. –3 °C, induntil da får klassisk slush-konsistas."
"89f3e5de-02cd-4849-b329-5f6663c204cf","Hazelnut Iced Coffee","Step","4","Server straks — gerne toppet med flødeskum eller et drys knuste nødder.","Servierein Sie sofürt — gerne toppet mit flødeskum oder et drys knuste nødder.","Servez immédiatemunt — gerne toppet avec flødeskum ou et drys knuste nødder.","Serve imwithiately — gerne toppet with flødeskum or et drys knuste nødder.","Serve imwithiately — gerne toppet with flødeskum or et drys knuste nødder."
"44b01475-bdbc-4f8c-9a96-5ae52a7b4899","Irish Coffee Slush","Description","","En fyldig og cremet frozen Irish coffee med den karakteristiske smag af whiskey, kaffe og fløde.
Perfekt som dessertdrik eller afslutning på en middag.
Alkoholen tilsættes til sidst for at bevare fryseevne og stabilitet.
Alkoholprocent (beregnet): ca. 5,5 % vol.","Ein fyldig und cremig frozein Irish coffee mit dein karakteristiske smag af whiskey, kaffe und fløde.
Perfekt als dessertdrik oder afslutning auf ein middag.
Alkoholein bissættes bis sidst für at bevare fryseevne und stabilitet.
Alkoholproceint (beregnet): ca. 5,5 % vol.","Un fyldig et crémeux frozun Irish coffee avec dun karakteristiske smag af whiskey, kaffe et fløde.
Perfekt comme dessertdrik ou afslutning sur un middag.
Alkoholun jusqu'àsættes jusqu'à sidst pour at bevare fryseevne et stabilitet.
Alkoholprocunt (beregnet): ca. 5,5 % vol.","A fyldig and creamy froza Irish coffee with da karakteristiske smag af whiskey, kaffe and fløde.
Perfekt as dessertdrik or afslutning on a middag.
Alkohola untilsættes until sidst for at bevare fryseevne and stabilitet.
Alkoholprocat (beregnet): ca. 5,5 % vol.","A fyldig and creamy froza Irish coffee with da karakteristiske smag af whiskey, kaffe and fløde.
Perfekt as dessertdrik or afslutning on a middag.
Alkohola untilsættes until sidst for at bevare fryseevne and stabilitet.
Alkoholprocat (beregnet): ca. 5,5 % vol."
"44b01475-bdbc-4f8c-9a96-5ae52a7b4899","Irish Coffee Slush","Step","1","Bryg en stærk espresso og lad den køle helt af.","Bryg ein stærk espresso und lad dein køle helt af.","Bryg un stærk espresso et lad dun køle helt af.","Bryg a stærk espresso and lad da køle helt af.","Bryg a stærk espresso and lad da køle helt af."
"44b01475-bdbc-4f8c-9a96-5ae52a7b4899","Irish Coffee Slush","Step","2","Bland espresso, mælk, sukkerlage og vand i en kande, og rør grundigt.","Mischein Sie espresso, mælk, sukkerlage und vand in einein Krug, und rør gründlich.","Mélangez espresso, mælk, sukkerlage et vand dans un pichet, et rør soigneusemunt.","Mix espresso, mælk, sukkerlage and vand in a pitcher, and rør thoroughly.","Mix espresso, mælk, sukkerlage and vand in a pitcher, and rør thoroughly."
"44b01475-bdbc-4f8c-9a96-5ae52a7b4899","Irish Coffee Slush","Step","3","Hæld blandingen i maskinen og kør ved ca. –3 °C, til ønsket slush-konsistens opnås.","Gießein Sie die Mischung in die Maschine und kør ved ca. –3 °C, bis ønsket slush-konsisteins opnås.","Versez le mélange dans la machine et kør ved ca. –3 °C, jusqu'à ønsket slush-konsistuns opnås.","Pour the mixture in the machine and kør ved ca. –3 °C, until ønsket slush-konsistas opnås.","Pour the mixture in the machine and kør ved ca. –3 °C, until ønsket slush-konsistas opnås."
"44b01475-bdbc-4f8c-9a96-5ae52a7b4899","Irish Coffee Slush","Step","4","Tilsæt whiskey til sidst, rør kort rundt og server straks.","Fügein Sie hinzu whiskey bis sidst, rør kort rundt und server sofürt.","Ajoutez whiskey jusqu'à sidst, rør kort rundt et server immédiatemunt.","Add whiskey until sidst, rør kort rundt and server imwithiately.","Add whiskey until sidst, rør kort rundt and server imwithiately."
"44b01475-bdbc-4f8c-9a96-5ae52a7b4899","Irish Coffee Slush","Step","5","Top med flødeskum for klassisk Irish coffee-look.","Garnierein Sie mit flødeskum für klassisk Irish coffee-look.","Garnissez avec flødeskum pour klassisk Irish coffee-look.","Top with flødeskum for klassisk Irish coffee-look.","Top with flødeskum for klassisk Irish coffee-look."
"44b01475-bdbc-4f8c-9a96-5ae52a7b4899","Irish Coffee Slush","Step","6","Alkohol tilsættes efter frysning for at undgå hæmning af isdannelse.
	•	Sukkerlage sikrer frysepunktssænkning og ensartet tekstur.
	•	Mælken giver fylde uden at maskinen “sætter sig”.
	•	Resultatet er en jævn, cremet voksen-slush med rund eftersmag af whiskey og kaffe.","Alkohol bissættes efter frysning für at undgå hæmning af isdannelse.
	•	Sukkerlage sikrer frysepunktssænkning und gleichmäßig tekstur.
	•	Mælkein giver fylde udein at maskinein “sætter sig”.
	•	Resultatet er ein glatt, cremig voksein-slush mit rund eftersmag af whiskey und kaffe.","Alkohol jusqu'àsættes efter frysning pour at undgå hæmning af isdannelse.
	•	Sukkerlage sikrer frysepunktssænkning et unipourme tekstur.
	•	Mælkun giver fylde udun at maskinun “sætter sig”.
	•	Resultatet er un lisse, crémeux voksun-slush avec rund eftersmag af whiskey et kaffe.","Alkohol untilsættes efter frysning for at undgå hæmning af isdannelse.
	•	Sukkerlage sikrer frysepunktssænkning and uniform tekstur.
	•	Mælka giver fylde uda at maskina “sætter sig”.
	•	Resultatet er a smooth, creamy voksa-slush with rund eftersmag af whiskey and kaffe.","Alkohol untilsættes efter frysning for at undgå hæmning af isdannelse.
	•	Sukkerlage sikrer frysepunktssænkning and uniform tekstur.
	•	Mælka giver fylde uda at maskina “sætter sig”.
	•	Resultatet er a smooth, creamy voksa-slush with rund eftersmag af whiskey and kaffe."
"e9da2f1e-6ef7-4c36-bfbc-1fee1faa542c","Tropical Energy Fusion","Description","","En tropisk energislush, der kombinerer frisk mango og syrlig passionfruit med energidrik – skabt til et eksotisk boost før træning eller som forfriskning i sommervarmen. Den balancerede frugtsødme og lette syre giver en glat, opløftende smag med naturlig energi.","Ein tropisk einergislush, der kombinerer frisk mango und syrlig passionfruit mit einergidrik – skabt bis et eksotisk boost før træning oder als fürfriskning i alsmervarmein. Dein balancerede frugtsødme und lette syre giver ein glat, opløfteinde smag mit naturlig einergi.","Un tropisk unergislush, der kombinerer frisk mango et syrlig passionfruit avec unergidrik – skabt jusqu'à et eksotisk boost før træning ou comme pourfriskning i commemervarmun. Dun balancerede frugtsødme et lette syre giver un glat, opløftunde smag avec naturlig unergi.","A tropisk aergislush, der kombinerer frisk mango and syrlig passionfruit with aergidrik – skabt until et eksotisk boost før træning or as forfriskning i asmervarma. Da balancerede frugtsødme and lette syre giver a glat, opløftade smag with naturlig aergi.","A tropisk aergislush, der kombinerer frisk mango and syrlig passionfruit with aergidrik – skabt until et eksotisk boost før træning or as forfriskning i asmervarma. Da balancerede frugtsødme and lette syre giver a glat, opløftade smag with naturlig aergi."
"e9da2f1e-6ef7-4c36-bfbc-1fee1faa542c","Tropical Energy Fusion","Step","1","Hæld energidrik og mangojuice i en kande.","Gießein Sie einergidrik und mangojuice in einein Krug.","Versez unergidrik et mangojuice dans un pichet.","Pour aergidrik and mangojuice in a pitcher.","Pour aergidrik and mangojuice in a pitcher."
"e9da2f1e-6ef7-4c36-bfbc-1fee1faa542c","Tropical Energy Fusion","Step","2","Tilsæt passionfruit puré og rør til ensartet blanding.","Fügein Sie hinzu passionfruit puré und rør bis gleichmäßig blanding.","Ajoutez passionfruit puré et rør jusqu'à unipourme blanding.","Add passionfruit puré and rør until uniform blanding.","Add passionfruit puré and rør until uniform blanding."
"e9da2f1e-6ef7-4c36-bfbc-1fee1faa542c","Tropical Energy Fusion","Step","3","Blend med is eller kør i slushmaskine ved ca. –3 °C.","Mixein Sie mit is oder kør i slushmaskine ved ca. –3 °C.","Mixez avec is ou kør i slushmaskine ved ca. –3 °C.","Blad with is or kør i slushmaskine ved ca. –3 °C.","Blad with is or kør i slushmaskine ved ca. –3 °C."
"e9da2f1e-6ef7-4c36-bfbc-1fee1faa542c","Tropical Energy Fusion","Step","4","Server straks – ideel før træning eller som tropisk energiboost.","Servierein Sie sofürt – ideel før træning oder als tropisk einergiboost.","Servez immédiatemunt – ideel før træning ou comme tropisk unergiboost.","Serve imwithiately – ideel før træning or as tropisk aergiboost.","Serve imwithiately – ideel før træning or as tropisk aergiboost."
"e9da2f1e-6ef7-4c36-bfbc-1fee1faa542c","Tropical Energy Fusion","Step","5","Teknisk note:
	•	Energidrikke med højt sukkerindhold (over 10°Bx) fryser hurtigere og giver en stabil slushstruktur.
	•	For sukkerfri versioner skal 10–15 g glycerin tilsættes for at bevare frysepunkt og konsistens.
	•	Mango tilfører naturlig sødme og farve, mens passionfruit skaber balance og friskhed.","Teknisk note:
	•	Einergidrikke mit højt sukkerindhold (over 10°Bx) fryser hurtigere und giver ein stabil slushstruktur.
	•	For sukkerfri versioner skal 10–15 g glycerin bissættes für at bevare frysepunkt und konsisteins.
	•	Mango bisfører naturlig sødme und farve, meins passionfruit skaber balance und friskhed.","Teknisk note:
	•	Unergidrikke avec højt sukkerindhold (over 10°Bx) fryser hurtigere et giver un stabil slushstruktur.
	•	For sukkerfri versioner skal 10–15 g glycerin jusqu'àsættes pour at bevare frysepunkt et konsistuns.
	•	Mango jusqu'àfører naturlig sødme et farve, muns passionfruit skaber balance et friskhed.","Teknisk note:
	•	Aergidrikke with højt sukkerindhold (over 10°Bx) fryser hurtigere and giver a stabil slushstruktur.
	•	For sukkerfri versioner skal 10–15 g glycerin untilsættes for at bevare frysepunkt and konsistas.
	•	Mango untilfører naturlig sødme and farve, mas passionfruit skaber balance and friskhed.","Teknisk note:
	•	Aergidrikke with højt sukkerindhold (over 10°Bx) fryser hurtigere and giver a stabil slushstruktur.
	•	For sukkerfri versioner skal 10–15 g glycerin untilsættes for at bevare frysepunkt and konsistas.
	•	Mango untilfører naturlig sødme and farve, mas passionfruit skaber balance and friskhed."
"dab6b649-16eb-4621-803c-a3060f31163c","Green Tea Energy Slush","Description","","En forfriskende og energigivende slush lavet på grøn te med naturlig koffein og antioxidanter.
Honningen tilfører mild sødme og fungerer som naturlig frysepunktssænker, så maskinen kører stabilt.","Ein fürfriskeinde und einergigiveinde slush lavet auf grøn te mit naturlig koffein und antioxidanter.
Honningein bisfører mild sødme und fungerer als naturlig frysepunktssænker, så maskinein kører stabilt.","Un pourfriskunde et unergigivunde slush lavet sur grøn te avec naturlig koffein et antioxidanter.
Honningun jusqu'àfører mild sødme et fungerer comme naturlig frysepunktssænker, så maskinun kører stabilt.","A forfriskade and aergigivade slush lavet on grøn te with naturlig koffein and antioxidanter.
Honninga untilfører mild sødme and fungerer as naturlig frysepunktssænker, så maskina kører stabilt.","A forfriskade and aergigivade slush lavet on grøn te with naturlig koffein and antioxidanter.
Honninga untilfører mild sødme and fungerer as naturlig frysepunktssænker, så maskina kører stabilt."
"dab6b649-16eb-4621-803c-a3060f31163c","Green Tea Energy Slush","Step","1","Bryg en stærk grøn te og lad den køle helt af.","Bryg ein stærk grøn te und lad dein køle helt af.","Bryg un stærk grøn te et lad dun køle helt af.","Bryg a stærk grøn te and lad da køle helt af.","Bryg a stærk grøn te and lad da køle helt af."
"dab6b649-16eb-4621-803c-a3060f31163c","Green Tea Energy Slush","Step","2","Rør honning ud i teen, til den er helt opløst.","Rührein Sie honning ud i teein, bis dein er helt opløst.","Remuez honning ud i teun, jusqu'à dun er helt opløst.","Stir honning ud i tea, until da er helt opløst.","Stir honning ud i tea, until da er helt opløst."
"dab6b649-16eb-4621-803c-a3060f31163c","Green Tea Energy Slush","Step","3","Tilsæt citronsaft og evt. frisk mynte.","Fügein Sie hinzu citronsaft und ggf. frisk mynte.","Ajoutez citronsaft et évuntuellemunt frisk mynte.","Add citronsaft and optionally frisk mynte.","Add citronsaft and optionally frisk mynte."
"dab6b649-16eb-4621-803c-a3060f31163c","Green Tea Energy Slush","Step","4","Hæld blandingen i maskinen og kør ved ca. –3 °C, til ønsket slushkonsistens opnås.","Gießein Sie die Mischung in die Maschine und kør ved ca. –3 °C, bis ønsket slushkonsisteins opnås.","Versez le mélange dans la machine et kør ved ca. –3 °C, jusqu'à ønsket slushkonsistuns opnås.","Pour the mixture in the machine and kør ved ca. –3 °C, until ønsket slushkonsistas opnås.","Pour the mixture in the machine and kør ved ca. –3 °C, until ønsket slushkonsistas opnås."
"dab6b649-16eb-4621-803c-a3060f31163c","Green Tea Energy Slush","Step","5","Server straks — gerne med et par mynteblade eller en skive lime.","Servierein Sie sofürt — gerne mit et par mynteblade oder ein skive lime.","Servez immédiatemunt — gerne avec et par mynteblade ou un skive lime.","Serve imwithiately — gerne with et par mynteblade or a skive lime.","Serve imwithiately — gerne with et par mynteblade or a skive lime."
